{
  "executor_type": "external_agent",
  "agent_identity": "doubao",
  "model_version": "doubao-pro-32k",
  "input_sha256": "4fc950a9a22510431b26b0406c4e354dec0c18c75f97c4fe8087d439795e5ad2",
  "prompt_or_skill_version": "b0-r2-calibrated-v1",
  "artifact_schema_version": "model-ir-1.0",
  "started_at": "2026-09-08T03:17:00Z",
  "finished_at": "2026-09-08T03:23:30Z",
  "latency_seconds": 390.0,
  "submitted_at": "2026-09-08T03:23:35Z",
  "node_id": "solving_strategy",
  "dag_position": 3,
  "payload": {
    "title": "分问题求解策略与算法流程(排队论为主)",
    "question": "Q001",
    "decision": "按Q1->Q2->Q3->Q4顺序求解，以M/M/c排队论解析为核心：Q1建立排队等待+期望收益决策阈值模型，Q2用真实数据校准排队参数并输出方案，Q3用排队容量规划(Erlang C确定最优服务台数c)+遗传算法优化上车点位置，Q4设计非抢占优先权排队系数并蒙特卡洛仿真验证收益均衡",
    "alternatives": [
      {
        "id": "alt_sequential",
        "name": "顺序求解(Q1->Q2->Q3->Q4)",
        "description": "按题目顺序逐步求解，前序问题的排队参数(mu, lambda, c)作为后序问题的输入",
        "pros": ["逻辑清晰", "排队参数传递自然", "符合论文叙事"],
        "cons": ["前序误差会累积", "Q2数据收集可能阻塞后续"]
      },
      {
        "id": "alt_parallel",
        "name": "并行求解(Q1/Q3先做，Q2/Q4后做)",
        "description": "先完成不依赖外部数据的Q1排队模型和Q3容量规划，同时收集Q2数据，最后做Q4优先权排队",
        "pros": ["减少数据收集等待", "核心排队模型先成型"],
        "cons": ["Q4依赖Q1和Q3结果", "协调成本高"]
      }
    ],
    "reasoning": "顺序求解更符合数学建模竞赛的论文结构和排队论参数依赖关系。Q1的M/M/c排队模型(mu, lambda, E[W])是Q2校准、Q3服务台数优化、Q4优先权排队的共同基础，必须先完成。Q2在Q1排队模型框架下填入真实数据，Q3在Q1服务率mu基础上用Erlang C优化服务台数c并遗传算法优化位置，Q4综合Q1收益模型和Q3系统吞吐设计非抢占优先权。选择顺序求解，每步输出明确的排队参数供后续使用。",
    "algorithm": {
      "Q1": {
        "name": "M/M/c排队论解析+期望收益阈值决策",
        "steps": [
          "1. 建立时变乘客到达率模型lambda(t)，基于航班到达量拟合为分段齐次泊松(高峰/平峰/低谷)",
          "2. 确定服务率mu：基于上下客时间观测，假设指数分布，mu=1/E[T_service]",
          "3. 用Erlang C公式计算蓄车池+乘车区M/M/c系统的等待概率P_wait(c, lambda, mu)和平均排队长度L_q",
          "4. 用Little定律W_q=L_q/lambda计算期望排队等待时间，E[W]=W_q+1/mu",
          "5. 计算Pi_A = f_0 + f_d*D - c_t*E[W](N_taxi, lambda, mu, c)",
          "6. 计算Pi_B = f_0 + f_d*d_city - c_e*D - c_t*(D/v + W_city)",
          "7. 求决策阈值：当E[W] < W_threshold=(f_0+f_d*D-Pi_B)/c_t时选A，否则选B",
          "8. 输出不同时段(高峰/平峰/低谷)和不同蓄车池车辆数下的司机选择策略表"
        ],
        "output": "M/M/c排队参数(mu, lambda, c)、决策阈值W_threshold、分时段策略表"
      },
      "Q2": {
        "name": "真实机场数据校准+排队参数敏感性分析",
        "steps": [
          "1. 收集目标机场(如上海浦东/北京首都/广州白云)航班数据、城市出租车运价、空驶率、平均里程",
          "2. 用航班时刻表拟合lambda(t)的分段参数，用出租车运营数据校准mu和成本参数(c_e, c_t, f_0, f_d)",
          "3. 将校准后的排队参数代入Q1的M/M/c模型，计算该机场的决策阈值W_threshold",
          "4. 输出该机场分时段司机选择方案(高峰/平峰/低谷各应选A还是B)",
          "5. 单因素敏感性分析：lambda, mu, c_e, c_t, D各变化±20%对决策阈值的影响，计算灵敏度系数"
        ],
        "output": "具体机场排队参数校准值、选择方案、因素依赖性分析(灵敏度系数排序)"
      },
      "Q3": {
        "name": "排队容量规划(Erlang C最优c)+遗传算法上车点位置优化",
        "steps": [
          "1. 排队容量规划：对c=1,2,...,c_max用Erlang C公式计算P_wait(c)和吞吐率lambda_out(c)=min(lambda,c*mu)*(1-P_loss(c))，找到使等待时间<阈值且吞吐率最大的最优服务台数c*",
          "2. 编码：染色体为两条车道的上车点位置(整数编码，间距受安全约束)",
          "3. 适应度：乘车区总吞吐率lambda_out，考虑c*个服务台的实际布局效率(位置影响车辆进出时间)",
          "4. 约束：安全间距x_{i+1}-x_i >= L_car+s_safe，每条车道上车点数<=floor(L_lane/(L_car+s_safe))",
          "5. 遗传操作：选择(锦标赛)、交叉(单点)、变异(位置扰动)，迭代N代",
          "6. 蒙特卡洛仿真验证最优布局的实际吞吐率和等待时间，与Erlang C解析值对比(相对误差应<5%)"
        ],
        "output": "最优服务台数c*、上车点数量和位置、调度方案(分批放行策略)、最大吞吐率"
      },
      "Q4": {
        "name": "非抢占优先权排队机制设计+收益均衡仿真",
        "steps": [
          "1. 定义短途阈值d_thresh(如<=15km)，统计短途比例p_short和短途/长途平均收益",
          "2. 非抢占优先权排队模型：将车辆分为高优先级(短途返回)和低优先级(普通)，高优先级排在低优先级前但不中断服务。用优先权排队公式计算W_high=W_q/(1+alpha)，W_low=W_q*(1+p_short*alpha)",
          "3. 优化目标：min_alpha Var(Pi_i(alpha))，即所有司机收益方差最小",
          "4. 约束：0<=alpha<=alpha_max(防止过度优先)，W_low<=W_max(保证普通司机等待时间不超过上限)",
          "5. 蒙特卡洛仿真：固定种子42，运行5组独立重复(每组10000次)，模拟有/无优先权下的收益分布和等待时间",
          "6. 输出最优alpha值、优先权实施规则(如短途专用通道/优先放行批次/短途标识)、收益均衡效果对比(方差降低百分比)"
        ],
        "output": "优先权系数alpha*、实施规则、收益均衡效果(方差降低%)、公平性检验(非短途收益下降幅度)"
      }
    },
    "feasibility": {
      "overall": "高",
      "Q1": "高——M/M/c排队论公式成熟(Erlang C+Little定律)，参数可假设或取行业均值，决策阈值可解析推导",
      "Q2": "中——需自行收集机场数据，公开数据可能不全，可用典型值替代并说明；排队参数校准方法明确",
      "Q3": "高——排队容量规划(Erlang C遍历c)有解析解，遗传算法处理位置整数规划成熟，约束明确",
      "Q4": "中高——非抢占优先权排队有理论基础，蒙特卡洛仿真验证可行，固定种子保证可复现",
      "risks": [
        "Q2数据获取不完整时需用合理假设替代，可能影响方案针对性",
        "Q3遗传算法参数(种群数、迭代数)需调试以避免局部最优",
        "Q4非抢占优先权排队公式在高利用率(rho->1)时数值敏感，需仿真交叉验证",
        "航班批次到达导致非平稳泊松，分段近似的粒度影响Q1精度"
      ]
    },
    "computational_plan": {
      "language": "Python 3.12",
      "libraries": ["numpy", "scipy(Erlang C数值计算)", "matplotlib", "simpy(离散事件仿真)", "deap(遗传算法)"],
      "random_seed": 42,
      "monte_carlo_runs": 5,
      "monte_carlo_samples_per_run": 10000,
      "ga_population": 100,
      "ga_generations": 200,
      "warm_up_period": "删除前10%仿真数据作为瞬态warm-up"
    },
    "depends_on": ["D001"]
  }
}
